{
  "id": "DP-004",
  "name": "Entry Confirmation Status",
  "stateRef": "CHECK_CONFIRMATION",
  "timing": "M-2 to M+5",
  "deadline": "M+4",
  "description": "Check if entry confirmations received by M+4 deadline.",
  "inputMetric": "confirmation_received",
  "operator": "boolean",
  "outcomes": [
    {
      "condition": "Confirmation Received / Entries Posted by M+4",
      "action": "proceed_to_unexplained_check"
    },
    {
      "condition": "Confirmation Not Received / Entries Not Posted by M+4",
      "action": "track_and_risk_assess",
      "description": "Track overdue entries and perform risk analysis."
    }
  ],
  "aiAugmentation": {
    "opportunity": "Auto-escalate approaching M+4 deadline with predictive risk scoring.",
    "dataNeeded": ["entry_id", "days_to_deadline", "team_response_history"]
  },
  "workflowRef": "tb-review-glo"
}
